{
  "$schema": "https://noirbizarre.github.io/gh-ship/schema/release/v1.json",
  "schemaVersion": 1,
  "changed": true,
  "version": "1.4.0",
  "tag": "v1.4.0",
  "release": {
    "name": "Release v1.4.0",
    "notes": "## What's Changed\n\n* Add `gh ship preview`\n",
    "prerelease": false,
    "make_latest": true
  },
  "pull_request": {
    "title": "Release v1.4.0",
    "body": "A fully overridden body.",
    "labels": ["release", "automated"]
  }
}
